{
  "campaign_id": "calibration-20260713",
  "case_ids": [
    "CAL-PASS-STREAM",
    "CAL-FAIL-TOOL-ENVELOPE",
    "CAL-FAIL-EMPTY-DUPLICATE",
    "CAL-FAIL-CANARY",
    "CAL-FAIL-EXIT-MISMATCH",
    "CAL-FAIL-ARTIFACT",
    "CAL-FAIL-CROSS-RUNTIME",
    "CAL-INCONCLUSIVE-TRANSPORT"
  ],
  "counts": {
    "BLOCKED_BY_ENV": 0,
    "BLOCKED_BY_SPEC": 0,
    "ERROR": 0,
    "FAIL": 6,
    "INCONCLUSIVE": 1,
    "PASS": 1,
    "SKIP": 0
  },
  "evidence_file": "calibration_evidence.jsonl",
  "evidence_sha256": "c2e6182a1a0a7e169ea0e417fe85f5b42666f4c87f9d86b6485b36e064a593d2",
  "evidence_size": 7189,
  "exit_code": 1,
  "namespace": "qa.calibration.20260713",
  "record_canonical_sha256s": [
    "038584c30c679a805d60163024a8d3870ad3df47035c8780e92161ae3a35a6d4",
    "074b67cda00a95afda2ef355c87e9d358d1f3383a0bca2116ea4e9de6c02a094",
    "c1e623c7afcc29828f2900574d40ce183d63f4ced1db23b1a7154ac7237bd622",
    "852081d674d442d60154cdb7ca3aa69d6e18f8e19c76975bc530628a5bb160dc",
    "52cfb70795bd565fd88d2af88238f03694c7b07869adc7828bf034009d2b07f5",
    "69f0bc967440db7a589a2a1df141cfb24b49dc54378dbaa26207dee26f495af5",
    "b0318bd2a40b4649943ac28b9f330295f53187e24932b560a773197fd5a3196a",
    "6c8ddc0c2afc2ea0ca003819cb9dc55fa0dd2f3e13fa26607a46707f74722a43"
  ],
  "record_count": 8,
  "record_sha256s": [
    "f944c8a28af685d814719911014473658daf59164c1b5dec1105d4bc4e3f8f12",
    "6699916eca62e45ef8c8cf75ba935ceccf448903f77b1430ae59e60d2156530f",
    "73290e979d40dad39307a7e008e3f420d48085ad13b7746e6ce187ad99d9b706",
    "b87613d6868eaf6b3c897c5ab0314cae8b2cea9fc7b57cc5ac13e70eadab76c7",
    "40107c18440e7e6e1fb481c20309b67dc9a4eed30236518338598afe40211e86",
    "e324db9e691c2601afa824093ea9c2c5e94dc4dbe1a11c43017613c3dd9e37fd",
    "dc428e51d5c65f99519c62985a02382904d0e8a522bb3c7d00e12a3e5fe15f53",
    "798b85229581d6a9852eb4a3333023f9393fd2e1dce203bbe5aab177cae78b03"
  ],
  "schema": "jarvis.qa.campaign-manifest.v2",
  "terminal_chain_sha256": "08e09a949f281b60c9da1476cab348f36bd15da92be3dd19f29fb07a47ed4d12"
}
